[
  {
    "additions_delta": 0,
    "anomaly_count": 0,
    "anomaly_flags": [],
    "anomaly_version": "1.0.0",
    "changed_files_delta": 0,
    "changed_files_mismatch": false,
    "deletions_delta": 0,
    "git_additions": 279,
    "git_changed_files": 16,
    "git_deletions": 96,
    "github_additions": 279,
    "github_changed_files": 16,
    "github_deletions": 96,
    "has_anomaly": false,
    "pr_id": "github.com/PostHog/posthog#pr/45696",
    "pr_lifetime_hours": 2826.492,
    "pr_number": 45696,
    "reconciliation_possible": true,
    "reconciliation_skipped_reason": null,
    "shape_flag_count": 0,
    "shape_flags": []
  },
  {
    "additions_delta": 0,
    "anomaly_count": 0,
    "anomaly_flags": [],
    "anomaly_version": "1.0.0",
    "changed_files_delta": 1,
    "changed_files_mismatch": false,
    "deletions_delta": 2,
    "git_additions": 19,
    "git_changed_files": 11,
    "git_deletions": 19,
    "github_additions": 19,
    "github_changed_files": 12,
    "github_deletions": 21,
    "has_anomaly": false,
    "pr_id": "github.com/PostHog/posthog#pr/46473",
    "pr_lifetime_hours": 2647.942,
    "pr_number": 46473,
    "reconciliation_possible": true,
    "reconciliation_skipped_reason": null,
    "shape_flag_count": 1,
    "shape_flags": [
      "bot_authored"
    ]
  },
  {
    "additions_delta": 0,
    "anomaly_count": 0,
    "anomaly_flags": [],
    "anomaly_version": "1.0.0",
    "changed_files_delta": 0,
    "changed_files_mismatch": false,
    "deletions_delta": 0,
    "git_additions": 1306,
    "git_changed_files": 4,
    "git_deletions": 400,
    "github_additions": 1306,
    "github_changed_files": 4,
    "github_deletions": 400,
    "has_anomaly": false,
    "pr_id": "github.com/PostHog/posthog#pr/46726",
    "pr_lifetime_hours": 2564.441,
    "pr_number": 46726,
    "reconciliation_possible": true,
    "reconciliation_skipped_reason": null,
    "shape_flag_count": 1,
    "shape_flags": [
      "bot_authored"
    ]
  },
  {
    "additions_delta": 0,
    "anomaly_count": 0,
    "anomaly_flags": [],
    "anomaly_version": "1.0.0",
    "changed_files_delta": 0,
    "changed_files_mismatch": false,
    "deletions_delta": 0,
    "git_additions": 127,
    "git_changed_files": 4,
    "git_deletions": 127,
    "github_additions": 127,
    "github_changed_files": 4,
    "github_deletions": 127,
    "has_anomaly": false,
    "pr_id": "github.com/PostHog/posthog#pr/46785",
    "pr_lifetime_hours": 2748.08,
    "pr_number": 46785,
    "reconciliation_possible": true,
    "reconciliation_skipped_reason": null,
    "shape_flag_count": 1,
    "shape_flags": [
      "bot_authored"
    ]
  },
  {
    "additions_delta": 0,
    "anomaly_count": 0,
    "anomaly_flags": [],
    "anomaly_version": "1.0.0",
    "changed_files_delta": 0,
    "changed_files_mismatch": false,
    "deletions_delta": 0,
    "git_additions": 1,
    "git_changed_files": 1,
    "git_deletions": 1,
    "github_additions": 1,
    "github_changed_files": 1,
    "github_deletions": 1,
    "has_anomaly": false,
    "pr_id": "github.com/PostHog/posthog#pr/47825",
    "pr_lifetime_hours": 2849.693,
    "pr_number": 47825,
    "reconciliation_possible": true,
    "reconciliation_skipped_reason": null,
    "shape_flag_count": 1,
    "shape_flags": [
      "docs_only"
    ]
  },
  {
    "additions_delta": 0,
    "anomaly_count": 0,
    "anomaly_flags": [],
    "anomaly_version": "1.0.0",
    "changed_files_delta": 0,
    "changed_files_mismatch": false,
    "deletions_delta": 0,
    "git_additions": 540,
    "git_changed_files": 13,
    "git_deletions": 19,
    "github_additions": 540,
    "github_changed_files": 13,
    "github_deletions": 19,
    "has_anomaly": false,
    "pr_id": "github.com/PostHog/posthog#pr/49264",
    "pr_lifetime_hours": 2824.785,
    "pr_number": 49264,
    "reconciliation_possible": true,
    "reconciliation_skipped_reason": null,
    "shape_flag_count": 0,
    "shape_flags": []
  },
  {
    "additions_delta": 0,
    "anomaly_count": 0,
    "anomaly_flags": [],
    "anomaly_version": "1.0.0",
    "changed_files_delta": 0,
    "changed_files_mismatch": false,
    "deletions_delta": 0,
    "git_additions": 335,
    "git_changed_files": 18,
    "git_deletions": 4,
    "github_additions": 335,
    "github_changed_files": 18,
    "github_deletions": 4,
    "has_anomaly": false,
    "pr_id": "github.com/PostHog/posthog#pr/50122",
    "pr_lifetime_hours": 2194.921,
    "pr_number": 50122,
    "reconciliation_possible": true,
    "reconciliation_skipped_reason": null,
    "shape_flag_count": 1,
    "shape_flags": [
      "bot_authored"
    ]
  },
  {
    "additions_delta": 0,
    "anomaly_count": 0,
    "anomaly_flags": [],
    "anomaly_version": "1.0.0",
    "changed_files_delta": 0,
    "changed_files_mismatch": false,
    "deletions_delta": 0,
    "git_additions": 130,
    "git_changed_files": 13,
    "git_deletions": 318,
    "github_additions": 130,
    "github_changed_files": 13,
    "github_deletions": 318,
    "has_anomaly": false,
    "pr_id": "github.com/PostHog/posthog#pr/51311",
    "pr_lifetime_hours": 3582.911,
    "pr_number": 51311,
    "reconciliation_possible": true,
    "reconciliation_skipped_reason": null,
    "shape_flag_count": 0,
    "shape_flags": []
  },
  {
    "additions_delta": 0,
    "anomaly_count": 0,
    "anomaly_flags": [],
    "anomaly_version": "1.0.0",
    "changed_files_delta": 0,
    "changed_files_mismatch": false,
    "deletions_delta": 0,
    "git_additions": 2363,
    "git_changed_files": 210,
    "git_deletions": 2077,
    "github_additions": 2363,
    "github_changed_files": 210,
    "github_deletions": 2077,
    "has_anomaly": false,
    "pr_id": "github.com/PostHog/posthog#pr/51923",
    "pr_lifetime_hours": 1555.481,
    "pr_number": 51923,
    "reconciliation_possible": true,
    "reconciliation_skipped_reason": null,
    "shape_flag_count": 1,
    "shape_flags": [
      "very_large_file_count:210"
    ]
  },
  {
    "additions_delta": 0,
    "anomaly_count": 0,
    "anomaly_flags": [],
    "anomaly_version": "1.0.0",
    "changed_files_delta": 0,
    "changed_files_mismatch": false,
    "deletions_delta": 0,
    "git_additions": 37,
    "git_changed_files": 2,
    "git_deletions": 43,
    "github_additions": 37,
    "github_changed_files": 2,
    "github_deletions": 43,
    "has_anomaly": false,
    "pr_id": "github.com/PostHog/posthog#pr/52155",
    "pr_lifetime_hours": 1678.31,
    "pr_number": 52155,
    "reconciliation_possible": true,
    "reconciliation_skipped_reason": null,
    "shape_flag_count": 0,
    "shape_flags": []
  },
  {
    "additions_delta": 0,
    "anomaly_count": 0,
    "anomaly_flags": [],
    "anomaly_version": "1.0.0",
    "changed_files_delta": 0,
    "changed_files_mismatch": false,
    "deletions_delta": 0,
    "git_additions": 28,
    "git_changed_files": 16,
    "git_deletions": 90,
    "github_additions": 28,
    "github_changed_files": 16,
    "github_deletions": 90,
    "has_anomaly": false,
    "pr_id": "github.com/PostHog/posthog#pr/52267",
    "pr_lifetime_hours": 1537.441,
    "pr_number": 52267,
    "reconciliation_possible": true,
    "reconciliation_skipped_reason": null,
    "shape_flag_count": 1,
    "shape_flags": [
      "bot_authored"
    ]
  },
  {
    "additions_delta": 0,
    "anomaly_count": 0,
    "anomaly_flags": [],
    "anomaly_version": "1.0.0",
    "changed_files_delta": 0,
    "changed_files_mismatch": false,
    "deletions_delta": 0,
    "git_additions": 59,
    "git_changed_files": 4,
    "git_deletions": 75,
    "github_additions": 59,
    "github_changed_files": 4,
    "github_deletions": 75,
    "has_anomaly": false,
    "pr_id": "github.com/PostHog/posthog#pr/53492",
    "pr_lifetime_hours": 1099.546,
    "pr_number": 53492,
    "reconciliation_possible": true,
    "reconciliation_skipped_reason": null,
    "shape_flag_count": 0,
    "shape_flags": []
  },
  {
    "additions_delta": 0,
    "anomaly_count": 0,
    "anomaly_flags": [],
    "anomaly_version": "1.0.0",
    "changed_files_delta": 0,
    "changed_files_mismatch": false,
    "deletions_delta": 0,
    "git_additions": 24,
    "git_changed_files": 4,
    "git_deletions": 44,
    "github_additions": 24,
    "github_changed_files": 4,
    "github_deletions": 44,
    "has_anomaly": false,
    "pr_id": "github.com/PostHog/posthog#pr/53793",
    "pr_lifetime_hours": 976.892,
    "pr_number": 53793,
    "reconciliation_possible": true,
    "reconciliation_skipped_reason": null,
    "shape_flag_count": 0,
    "shape_flags": []
  },
  {
    "additions_delta": 0,
    "anomaly_count": 0,
    "anomaly_flags": [],
    "anomaly_version": "1.0.0",
    "changed_files_delta": 0,
    "changed_files_mismatch": false,
    "deletions_delta": 0,
    "git_additions": 1420,
    "git_changed_files": 5,
    "git_deletions": 5,
    "github_additions": 1420,
    "github_changed_files": 5,
    "github_deletions": 5,
    "has_anomaly": false,
    "pr_id": "github.com/PostHog/posthog#pr/53803",
    "pr_lifetime_hours": 1289.889,
    "pr_number": 53803,
    "reconciliation_possible": true,
    "reconciliation_skipped_reason": null,
    "shape_flag_count": 0,
    "shape_flags": []
  },
  {
    "additions_delta": 0,
    "anomaly_count": 0,
    "anomaly_flags": [],
    "anomaly_version": "1.0.0",
    "changed_files_delta": 0,
    "changed_files_mismatch": false,
    "deletions_delta": 0,
    "git_additions": 780,
    "git_changed_files": 24,
    "git_deletions": 1826,
    "github_additions": 780,
    "github_changed_files": 24,
    "github_deletions": 1826,
    "has_anomaly": false,
    "pr_id": "github.com/PostHog/posthog#pr/53837",
    "pr_lifetime_hours": 1006.143,
    "pr_number": 53837,
    "reconciliation_possible": true,
    "reconciliation_skipped_reason": null,
    "shape_flag_count": 0,
    "shape_flags": []
  },
  {
    "additions_delta": 0,
    "anomaly_count": 0,
    "anomaly_flags": [],
    "anomaly_version": "1.0.0",
    "changed_files_delta": 0,